<?xml version="1.0" encoding="UTF-8"?>

<!-- New XML document created with EditiX XML Editor (http://www.editix.com) at Fri Oct 18 08:54:58 CEST 2019 -->


<contacts xsi:noNamespaceSchemaLocation="contacts.xsd" xmlns:xsi="http://www.w3.org/2001/XMLSchema-instance">
	<contact>
		<category>Person</category>
		<name>
		
			Dutronc
		
		</name>
		<surname>

			Paul

		</surname>
		<pnumbers>
			<number type="mobile">

				0612345678

			</number>
		</pnumbers>
		<address>
			<street number="12">

				Rue du Pont

			</street>
			<city>

				Paris

			</city>
			<zipcode>

				750111

			</zipcode>
			<country>

				FR

			</country>
		</address>
	</contact>
</contacts>
